#NAME?,"Sorry, the query is too large to fit into the Excel cell. You will not be able to update your table with the .Stat Populator.",,,,,,,,,,,,,,,,,,,,,,,,,,,,,,,,,,,,,,,,,,,
Dataset: Input-Output Tables,,,,,,,,,,,,,,,,,,,,,,,,,,,,,,,,,,,,,,,,,,,,
Variable,,TTL: Total,,,,,,,,,,,,,,,,,,,,,,,,,,,,,,,,,,,,,,,,,,
Country,,USA: United States,,,,,,,,,,,,,,,,,,,,,,,,,,,,,,,,,,,,,,,,,,
Time,,2000,,,,,,,,,,,,,,,,,,,,,,,,,,,,,,,,,,,,,,,,,,
Unit,,"US Dollar, Millions",,,,,,,,,,,,,,,,,,,,,,,,,,,,,,,,,,,,,,,,,,
Column sector (to:),,"C01T05: Agriculture, hunting, forestry and fishing",C10T14: Mining and quarrying,"C15T16: Food products, beverages and tobacco","C17T19: Textiles, textile products, leather and footwear",C20: Wood and products of wood and cork,"C21T22: Pulp, paper, paper products, printing and publishing","C23: Coke, refined petroleum products and nuclear fuel",C24: Chemicals and chemical products,C25: Rubber and plastics products,C26: Other non-metallic mineral products,C27: Basic metals,C28: Fabricated metal products,"C29: Machinery and equipment, nec","C30T33X: Computer, Electronic and optical equipment","C31: Electrical machinery and apparatus, nec","C34: Motor vehicles, trailers and semi-trailers",C35: Other transport equipment,C36T37: Manufacturing nec; recycling,"C40T41: Electricity, gas and water supply",C45: Construction,C50T52: Wholesale and retail trade; repairs,C55: Hotels and restaurants,C60T63: Transport and storage,C64: Post and telecommunications,C65T67: Financial intermediation,C70: Real estate activities,C71: Renting of machinery and equipment,C72: Computer and related activities,C73T74: R&D and other business activities,C75: Public administration and defence; compulsory social security,C80: Education,C85: Health and social work,"C90T93: Other community, social and personal services",C95: Private households with employed persons,HFCE: Households final consumption expenditure,NPISH: Non-profit institutions serving households,GGFC: General Government final consumption,GFCF: Gross Fixed Capital Formation,INVNT: Changes in inventories,CONS_ABR: Direct purchases abroad by residents (imports),CONS_NONRES: Direct purchases by non-residents (exports),EXPO: Exports (cross border),IMPO: Imports (cross border)
Row sector (from:),,,,,,,,,,,,,,,,,,,,,,,,,,,,,,,,,,,,,,,,,,,,
"TTL_C01T05: Agriculture, hunting, forestry and fishing",,44320.9,47.7,99008.2,2220.2,10431,3499.2,4.3,2526.4,881.4,6.7,6.2,8.7,14.9,17.4,12.5,37.5,5.4,402.3,9,1283.5,4341,3615,45.1,70.4,30.6,148.6,5,14.3,621.8,1014.5,501.5,169.6,317.9,0,52953.2,103.6,0,375,-2418.6,93.7,14.7,20691.7,-15473.9
TTL_C10T14: Mining and quarrying,,1152,19228.2,917.2,133.5,43.1,1257.7,128880.5,9159.3,219,4888.4,9326.7,220.8,194,217.3,139.8,135.4,115,187.5,53801.2,9490,270.5,372,4683.6,150.4,157,2950.8,81.7,84.8,824.6,8036.2,227,300.4,620,0,5879.7,0,0,4162.9,-2477,42.2,122.7,5867.1,-85481.5
"TTL_C15T16: Food products, beverages and tobacco",,10613.5,73.3,64651.5,1082.5,79.2,949.4,177.9,2625.3,375.2,110.1,73.3,120.4,133.8,299.9,71.1,267.1,59.7,135.3,104.6,373.7,3118.1,42382.7,208.2,83.7,173.6,185.6,20.1,77.2,670.8,15215,18138,6293.6,2010.4,0,350563.7,0,0,712.7,2093.9,3017.6,3095.9,27301.6,-32617.8
"TTL_C17T19: Textiles, textile products, leather and footwear",,487.5,61.9,341.8,26122.5,394.6,2606.4,98.8,1107.9,1720,220.9,69.9,117.2,565.9,221.7,72.8,6021.4,462.7,3630.9,50.3,2364.2,3985,1108.3,305.2,117.4,83.3,397.9,80.1,41.7,541.1,3236.4,356.3,1917.7,1370.3,0,133861.7,0,0,636.9,2344.3,3222.5,4702.1,14953.6,-74566.9
TTL_C20: Wood and products of wood and cork,,555.6,123.2,324.7,124.6,20135.1,5191.9,14.3,387,1090.2,499.3,217.7,275.7,861.4,763.3,298.7,2004.6,143.3,7679.7,11.6,34652,2162,2190.3,1197.3,452.3,101.8,7668.1,274.3,741.9,442.5,2542.1,162.4,720.3,945.9,0,3613.5,0,0,295,1034.9,23.2,15.2,4541.1,-13912.1
"TTL_C21T22: Pulp, paper, paper products, printing and publishing",,687.9,833.2,18294.1,2244.8,750.1,95660.8,276.9,10062.5,4841.7,1928.6,1386.1,2624.3,2933.2,4766.4,1823.5,2987.5,971.8,3677.7,2163.3,5846.8,27264,8765.9,5221,4056.9,19167.9,5907.6,868.1,5250,29853.1,34406.9,6107.1,15631.9,8845,0,101143,18.9,1037,42254.9,2602.9,40.7,244.2,39496,-24616
"TTL_C23: Coke, refined petroleum products and nuclear fuel",,4389.9,2335.2,1096.2,421.3,376.6,2165.1,3328.9,11117.1,1114.4,319.9,542.1,803.1,875.5,630.4,676,327.6,144.8,460,13435.8,16943.5,2551.2,1865.7,35486.7,295.9,1150.6,1003.9,181.9,251.2,5500.3,34088.3,749.4,2328.6,2812.1,0,83279.5,0,0,238.1,-1967,1162.6,1975.7,12804.6,-27674.2
TTL_C24: Chemicals and chemical products,,9884.8,2722.5,4329.8,11246.2,1519.9,11908,1667.8,87389.8,27978,2449.4,1071.6,4926.4,3001.8,5887.4,2779.7,4131.8,1025.2,4772.8,1533.5,7129.6,3436,1141.6,2687.2,861.9,2164.8,5901.6,184.2,787.3,7273.8,12713.8,1736.6,34600.9,3045.7,0,128019.2,0.1,0,4009.9,1884.3,1441.3,2471.3,70352.3,-67525.8
TTL_C25: Rubber and plastics products,,1325.5,695.1,10576.1,910.8,611.2,3485.2,165.8,8649.1,11976.7,882.4,735.2,2159.7,5943.8,4574,2095.4,15821.2,2613,7545.6,101.5,20247.6,11338,4881.7,4537,1769.3,943.1,1581.8,325.2,578.7,3260.9,6266.2,1274.1,5644,3460.8,0,25738.7,0,0,1235.7,1610.3,68.9,67.3,15864,-23604.8
TTL_C26: Other non-metallic mineral products,,83.7,741.3,3069.7,537,841.6,252.9,565.2,1476.5,1152.1,10188.2,1159.3,944.5,1324.2,1203.2,2150.5,4062.4,182.3,1055.3,225.2,39679.8,1000.6,3300.5,196.8,777.1,226.5,2384.6,65.2,456.6,1828.7,2043.2,669.3,2812,924.4,0,7732.8,0,0,659.8,563,20.2,14.7,6760.9,-12663.5
TTL_C27: Basic metals,,138.7,1925.1,3640.2,239.1,200.5,703.1,162.3,698.5,1247.8,614.3,33802.4,39523.5,17822.2,6919.2,13537.8,25660.9,4751.6,6174.3,62.7,3442.2,1207.9,342.2,538.9,241.4,61.4,1002.6,126.2,157.2,990.8,521.3,232,330.8,529.2,0,4093.4,0,0,564.3,840.2,21.2,21.2,13680.6,-39462.8
TTL_C28: Fabricated metal products,,1017.5,2433.7,9368.1,1376.7,2061.1,8148.5,163.1,6950.1,5193.6,1995.9,4621.9,22582,17436.6,13704.8,8860,24488.5,6950.4,5872,165.3,51726.6,3956.8,4660.9,5514.3,4023.7,380.9,2087.1,297.9,1409.5,3266.7,6021.3,951.6,1222.7,2557.5,0,12900.7,1.8,0,9573,3036.4,66.1,52.9,20069.2,-25466.1
"TTL_C29: Machinery and equipment, nec",,3479.2,9510.7,2625.5,338.2,669.4,5199.8,189.8,4579.8,3022.2,563.4,2346.3,5238.1,37989.3,2586.8,4282.4,23607.6,5255.9,1720.5,1951.9,37393.2,3589,1879.2,2404.4,939.7,477.3,3585.7,393.5,1664.2,4151.3,6181.2,5968.6,1273,5968.4,0,20035.6,0.1,0,59446.3,7410.6,918.7,1198.3,71362.1,-78732.4
"TTL_C30T33X: Computer, Electronic and optical equipment",,247.1,322.3,3244.1,2096.9,961.4,10810.5,267.7,6081.6,2779.1,1599.8,2243.8,5129.2,8940.8,150209.9,6126.7,18441.3,10712.2,4144.5,628.3,7908,14205.1,2490.1,1255.8,14133.2,5821.4,1700.3,186.2,6492.8,14207.5,16141.6,3018,4674,6657.1,0,75378.1,2.8,0,123302.2,15894.5,1637.2,2759.7,176350.7,-248627.3
"TTL_C31: Electrical machinery and apparatus, nec",,510.9,153,763,224.2,460.6,614.7,72.4,994.7,858.2,148.1,1600.5,2214.1,7504.7,6696.8,8087.3,3798.6,1454.9,752.4,67.7,24615.9,1878,1895.8,629,2260.9,387.2,828.3,95,1374.4,3522.9,3086.5,1147.7,564.3,1751.1,0,29403.3,0,0,29468.2,2141.9,62.1,55.9,23776.9,-50309.7
"TTL_C34: Motor vehicles, trailers and semi-trailers",,949.5,962.2,2259.9,329.5,670.8,2686.9,77.6,1493.8,597,640.7,646.1,1669.8,9336.5,3207.2,580.9,122689.7,4182.8,920.8,194.3,11124.4,14765.8,947.5,12952.4,744.5,1821.6,732.4,581.1,377.7,4600.9,7200.4,812.7,1376.8,12269.7,0,242577.8,0,0,49172.8,13052.4,61.8,207,69247.6,-155671.7
TTL_C35: Other transport equipment,,150.5,180.8,286.6,95.2,58.6,456.9,23.9,382.8,133.8,45.9,84.6,227.7,772.7,512.6,143.9,596.1,24319,114.4,229.9,903.3,1137.2,271.1,3184.1,345.9,915.5,678.9,56.6,324.3,1475.1,9889.7,213,635.5,588.8,0,15065.7,0,0,70489.8,-12261.1,18.4,26.2,58539.9,-33159.1
TTL_C36T37: Manufacturing nec; recycling,,221.8,227.2,429.6,539.4,814.2,1990.8,104.4,851.8,543.6,428.7,5914.3,442.5,1595.8,947.9,443,1586,245.4,5099.4,190.4,8471.8,3043.9,1320.4,1695.2,374.1,764.3,2323.3,65.6,393.8,1888.4,2950.5,1382.8,11413.7,2248.7,0,113966.7,0,0,20790.3,5309.7,2602.3,3537.4,27921,-54335.5
"TTL_C40T41: Electricity, gas and water supply",,4489.2,5867.1,6982.2,2101.9,1617.2,6871.7,1288.8,9453.1,3440,2618.9,5263.6,3262.5,1709.8,3365.5,1007,2004.1,704.2,1297.2,2506.5,3710.8,17560,10025.7,3032.1,3814.8,3689.5,37868.3,758.7,1070.9,6063.1,14370.9,21725.1,8416.2,5737.9,0,131449.1,0.1,756.4,1579,-231.8,59.6,90,1251.7,-2685.1
TTL_C45: Construction,,1297.6,1921.1,1624,344,496.5,1681.6,250.3,1943.8,833.6,602.4,1102.6,1001.2,659.1,1398.7,303.5,595.3,210.8,485.6,4373.5,716.4,3759.4,2408.7,3466.1,3516.9,4952.2,44672.7,227.6,258.8,4218.9,30315.3,1589.4,1504,3050.7,0,148.1,0,0,767195.3,-971.2,82.9,0,2026.5,-1861.3
TTL_C50T52: Wholesale and retail trade; repairs,,24692.3,9608.4,71444.8,28937.7,11141.6,39400.9,28551,41044.5,17087.2,7949.2,12952,14969.5,21511.1,56170.7,9605.8,46351.9,9668.3,16426.6,16032.8,64044.8,66736.6,30608.3,26404.9,14972.9,14465,14132.7,3173.2,8478.3,26774.2,49300.1,16858.4,32263.5,21633.4,0,724973.2,7262.5,136.6,83410.5,14909.1,4748.4,7776.4,94688.7,-186520.9
TTL_C55: Hotels and restaurants,,158.6,81.7,1039.8,264.6,293.2,2295.6,133.6,671.6,634,234.8,251.2,767.1,490.2,585.4,108.3,504.7,116.3,497.9,4306.4,2239.2,5600.1,8217.1,7045.7,2279,11946.5,5620.9,499.6,5171.3,21240.7,7201,2980.6,7532.2,4277,0,329955.6,1485.7,0,1521.4,3.1,27450.5,26178.8,562.8,-28413.3
TTL_C60T63: Transport and storage,,6360.9,4226.4,16634.8,2811.5,2413.8,14138.6,8069.9,8740.2,3311.3,3761.3,6037,3348.1,3413.9,6062.8,1727.5,5621.2,1499,2891.3,19328.1,14405.8,51661.8,4730,52954.3,2146.5,12769.1,4386.9,1273.6,5700.8,22464,26323.8,4591.9,9770.4,10393.4,0,148994.6,14.3,32.1,9050.6,1927.9,26804.4,31709.2,64602.2,-71659.6
TTL_C64: Post and telecommunications,,373.9,970.7,2153.9,711.3,418,6872.6,170.7,2398,924.2,443.7,464.3,1484,1530.7,2998.8,459.3,1131,509.1,1131.9,2068.4,9010.1,21094.5,4483.7,9186.7,106511.9,27641.3,12316.7,1178.8,12341.5,32133.9,31068.2,4191.6,12883.7,7646.2,0,224975.6,241.9,4.2,14773.8,-85.2,35.8,338.1,8206.7,-7890.8
TTL_C65T67: Financial intermediation,,8328.2,6714.9,5084.2,2228,746.7,8176.7,338.2,4576.5,2473.4,1262.8,2343.7,5510.8,4562.5,5522.9,1601,3798.6,1063.8,3755.6,25204.6,13401.6,49798.5,12001.9,24278.7,7578,387135.6,97320.9,3687,9516.5,49436.5,21391.8,8788.2,34794.1,35077.7,0,651420.9,0,0,3659.2,-371.9,90.6,204.4,42238.6,-48965.1
TTL_C70: Real estate activities,,9487.6,639.3,1862,475.3,326.8,6968.3,45.9,1293.1,1003.1,386.4,274.2,1720.8,1091.1,1163.1,364.6,385.5,334.6,1134.7,4638.1,4534.8,51054.3,14910.8,8276.2,5789.1,34546.8,65425,2470.4,6692.1,37714.5,21502.7,28942.2,58163.5,26489.1,0,1014900,57.8,0,19196.9,-86.3,4037.3,4438.1,2845.9,-5217.5
TTL_C71: Renting of machinery and equipment,,531.7,2949,1025.8,331.2,117.6,1698.3,88.3,1641.5,346.7,185.3,186.5,720.6,526.7,1262.3,226.9,513.4,198.3,419.4,814,3533.6,5024,1326.8,4594.3,3113.1,3147.1,425.7,391.4,2256.5,5253.7,1195.2,1193.7,1683.7,1189.8,0,20196.4,24.2,0,122.1,-8.3,4037,2793.1,10845.6,-7183.3
TTL_C72: Computer and related activities,,393.1,1173.1,2074.3,651.6,543.9,6083.8,278.5,1888.8,969,451.1,469.6,1360.6,1552.3,2950.3,335.6,844.2,512.7,1113.8,4101.5,3115.3,10702.9,2072.2,2413.2,4837.2,25100.6,4548.1,899.8,7540.5,22783.2,33745.4,4851.7,5658.6,3921.5,0,10577.5,218,572.5,82000.4,-101,23.4,51.4,7190,-7163.9
TTL_C73T74: R&D and other business activities,,2138.9,8700.5,25550,7414.6,2937.8,43528.8,1523.5,31986.7,6949,3645.7,5032.1,10035.9,10301,26374.2,4382.4,10087.2,6004.1,7396.6,24419.8,31587.2,118727,27055.8,35363.8,35764.4,105035.3,75486.5,5748.5,34181.4,147347.6,61836.1,15061,64880.3,39433.9,0,113387.4,94.3,0,256594.2,-713.4,121.3,21.3,47295,-24801.6
TTL_C75: Public administration and defence; compulsory social security,,1227.5,1149.9,2810.7,653.7,466.2,3802.7,459.2,2550.9,825.4,566.9,1094.4,919.6,943.5,1487,529.4,742.9,299.9,586.8,2227.4,2126,13268.4,4607.2,6946.5,2604.2,9751.4,8820.5,545.2,1965.5,9136.3,9094.2,5279.9,6607,4667.1,0,134475.9,8373.8,967953.6,14706,5.1,305.5,1566.9,3647.5,-1356.8
TTL_C80: Education,,197.9,395.4,1249.5,369.9,173.8,2142,118.3,1427.1,381.8,188.5,252,523.9,520.6,1235,203.8,527,272.5,388.4,1614.9,1624.4,8294.4,1953.3,2193.5,1815.9,5965,3732.8,300.7,2117.4,8507.8,5652.9,2108.1,3463.7,2330.5,0,98714.5,8089.7,441681,14227.5,-26.1,1033.3,3406.3,2129.3,-1208.9
TTL_C85: Health and social work,,102.1,103.9,324.2,112.5,49.4,275.8,95.1,236.6,83.5,39.7,56.9,89.4,105.2,254.1,44.9,175.4,46.4,81.4,146.7,348,599.7,213.4,269.9,186,451.7,269.5,33.7,181,880.5,5072.2,136.2,14121.2,275.5,0,806138.5,93875.2,0,1900.7,3.2,1622.2,685.6,681.4,-1852.5
"TTL_C90T93: Other community, social and personal services",,764.4,1045.2,2787.9,706.6,717.1,3768.7,296.7,2913.6,1343.1,836.2,1513,1623.6,1067.5,2184.4,430.5,1037.6,368.1,909.5,2190.7,11120.3,14846.7,5862.3,4342.3,28369.9,11866.6,10244.2,1516.5,4324.1,18902.7,28770.6,7149,9804.3,35080.7,0,376881.7,45534.9,1610.8,2364.8,-241.2,8642.9,7455.9,12347.3,-14418.3
TTL_C95: Private households with employed persons,,0,0,0,0,0,0,0,0,0,0,0,0,0,0,0,0,0,0,0,0,0,0,0,0,0,0,0,0,0,0,0,0,0,0,13168.8,0,0,0,0,0,0,0,0
TXS_INT_FNL: Taxes less subsidies on intermediate and final products,,-5584.8,1052.6,-10474.9,520.8,193.4,716.5,827.2,1999.6,354.7,248.8,396.7,457.2,554.2,398.4,312,871.3,159.7,248.7,3260.1,5084.8,486.1,633.3,8486.2,147.6,-1.9,1147.7,40.3,54,1536.3,5327.3,1387.1,143.7,736.9,0,369082.3,0,0,0,0,0,8239.3,0,0
TTL_INT_FNL: Total intermediate and final expenditure at purchasers' prices,,135175.4,89175.8,357399.4,98917.5,63731.9,306010.4,178776.8,271299.7,106684.2,50952.5,103538,137022.5,167786.5,316779.8,73824.5,331856.7,85563.2,93110.7,192159.9,454199.2,542464.6,214541.4,281996.5,255146.2,693290.3,427488.4,26632.9,122328.2,499314.9,523723,170482.2,363599.8,258864.6,0,6575646.5,165400,1413784.2,1689690.1,54707.6,93616.1,115537.1,980140,-1475100.1
VALU: Value added at basic prices,,96802.6,97406,167721.7,46516.6,26834.1,192317.9,40811.9,143244.5,61271.4,39715.6,43768.4,114679.1,104878.2,163796.4,41788,111195.1,62591.5,87633.9,143803.6,438203.5,1082312.4,249489.2,273449.2,304357.1,802486.6,1012789.7,52306.3,130978.4,928601.2,714717.8,459807.1,564916.1,400018.6,13168.8,0,0,0,0,0,0,0,0,0
OUTPUT: Output,,231978,186581.7,525121.1,145434.1,90566,498328.3,219588.7,414544.2,167955.6,90668.1,147306.4,251701.5,272664.7,480576.2,115612.5,443051.8,148154.7,180744.6,335963.5,892402.7,1624777,464030.6,555445.7,559503.3,1495776.9,1440278.2,78939.1,253306.6,1427916.2,1238440.8,630289.3,928515.9,658883.2,13168.8,0,0,0,0,0,0,0,0,0
Data extracted on 12 Oct 2018 08:00 UTC (GMT) from OECD.Stat,,,,,,,,,,,,,,,,,,,,,,,,,,,,,,,,,,,,,,,,,,,,
